id,name,meta_description
1,Tische,"Massive Holztische aus der Schreinerei Hobel in Zürich: Esstische, Gartentische und Massivholz-Tischplatten nach Mass – handgefertigt aus Schweizer Handwerk."
2,Sitzmöbel,"Stühle, Hocker, Sitzbänke und Barhocker aus Massivholz. Handwerklich gefertigte Sitzmöbel von Hobel sowie Schweizer Klassiker von horgenglarus."
3,"Gedeckter Tisch","Geschirr, Gläser und Tischkultur für den gedeckten Tisch: Pillivuyt Porzellan, Iittala Gläser, Stelton und Hergiswiler Glas – jetzt bei Hobel."
4,Schneidebretter,"Handgefertigte Schneidebretter und Brotbretter aus massivem Holz. Robuste, langlebige Küchenhelfer aus der Schreinerei Hobel in Zürich."
5,Serviertabletts,"Serviertabletts aus Massivholz, entworfen von Stefan Zwicky. Vielseitige Tabletts aus Ahorn, Nussbaum, Kirschbaum, Eiche und Birnbaum bei Hobel."
6,Wohnen,"Wohnaccessoires aus Holz: Spiegel, Bilderrahmen, Vasen, Kerzenhalter und mehr. Handwerklich gefertigte Wohnideen aus der Schreinerei Hobel."
